{
  "blocking": true,
  "decision": "contradicted",
  "fixture_id": "fixture.prohibited-outcome",
  "forbid_prohibited_outcomes": false,
  "minimum_blocking_failures": 1,
  "required_quality_statuses": {},
  "required_requirement_statuses": {
    "requirement.durable-output": "contradicted"
  },
  "schema_version": "1.0.0"
}
